candidate,source_type,coverage_for_local_streets,alignment_to_gdot_rclink,additional_attributes,licensing_or_usage,recommended_role,source_urls
GDOT EOC_SUPPORT_LAYERS / GDOT Roads,Official GDOT ArcGIS Feature Layer,Low improvement in Dinglewood test,Excellent,"ROUTE_ID; ROUTE_KEY; FUNCTION_TYPE; COUNTY; SYSTEM_CODE; DIRECTION",GDOT-specific usage restrictions in service description,Validation source but not sufficient standalone gap filler in tested AOI,https://rnhp.dot.ga.gov/hosting/rest/services/EOC/EOC_SUPPORT_LAYERS/MapServer/5?f=pjson
GDOT Functional Classification / Local Road,Official GDOT / ITOS ArcGIS Feature Layer,Low improvement in Dinglewood test,Excellent,"route_id; from_measure; to_measure; SYSTEM_CODE; FUNCTIONAL_CLASS",GDOT / ITOS service terms apply,Validation and enrichment source not proven as statewide gap filler,https://maps.itos.uga.edu/arcgis/rest/services/GDOT/GDOT_FunctionalClass/MapServer/6?f=pjson
GDOT ARCWEBSVCMAP / Statewide Roads,Official GDOT ArcGIS Feature Layer,Unknown because service timed out during AOI verification,Excellent,"RCLINK; ROAD_NAME; ROUTE_TYPE; OWNERSHIP; DIVIDED; ONE_WAY; PAVED; SURFACE_TYPE; NUMBER_TRAVEL_LANE; SPEED_LIMIT; FUNCTIONAL_CLASS; COUNTY_CODE; GDOT_DISTRICT; DATA_SOURCE; REVISION_DATE",GDOT-specific usage restrictions in service description,Most promising GDOT-aligned supplement still needing dedicated extraction test,https://egisp.dot.ga.gov/arcgis/rest/services/ARCWEBSVCMAP/MapServer/4?f=pjson
TIGER/Line All Roads or All Lines,Federal Census road product,High,Moderate,"FULLNAME; RTTYP; MTFCC; LINEARID; county/state identifiers",Low friction federal source,Best first statewide public-domain geometry filler,https://www.census.gov/geographies/mapping-files/time-series/geo/tiger-geodatabase-file.html
OpenStreetMap / Geofabrik Georgia extract,Crowdsourced open road network,Highest,Moderate to low,"name; ref; oneway; maxspeed; layer; bridge; tunnel; detailed local road classes",ODbL attribution and share-alike obligations,Coverage-maximizing supplemental source if TIGER remains too sparse,https://www.openstreetmap.org/copyright | https://download.geofabrik.de/north-america/us/georgia.html
USGS National Transportation Dataset,USGS national transportation product,High to moderate,Moderate,"roads plus railroads; trails; airports; broader transportation context",Public domain,Multimodal supplemental source,https://www.usgs.gov/tools/download-data-maps-national-map | https://data.usgs.gov/datacatalog/data/USGS%3Aad3d631d-f51f-4b6a-91a3-e617d6a58b4e
Georgia GIS Clearinghouse / county road centerlines,State and local GIS portals,Variable,Variable,"Often locally rich county attributes but inconsistent statewide",Varies by publisher,County-by-county patch source,https://georgiagisclearinghouse.com/ | https://data.georgiaspatial.org/
